"Key","Source","Translation"
"A4F592AA4BD1D02F9320A697928C97D8","There must be a way to control the water level in this reservoir. I need to find the wheel.","There must be a way to control the water level in this reservoir. I need to find the wheel."
"A34126F447CEDC11ABCAA7BF27C37986","There’s no one in.","There’s no one in."
"6BFC6BBC46B7FF8428F8F7A7FF9502DC","There’s nobody here.","There’s nobody here."
"639925444F574E011B039DA46D2BD339","There! I confessed to that vicar. Do I feel better? Only time will tell.","There! I confessed to that vicar. Do I feel better? Only time will tell."
"24E7511F43AF3A46C012418E751251B3","These Skals can be so ferocious. I'm not sure I can defeat them without becoming stronger. To drink blood is so tempting.","These Skals can be so ferocious. I'm not sure I can defeat them without becoming stronger. To drink blood is so tempting."
"6240DDF6489851C4E2F1F9A1FA8D0096","These men, they're a company of professional Vampire Hunters?","These men, they're a company of professional Vampire Hunters?"
"098EE54D4936AB40EC9211831C1FC1FB","They must be busy at the moment.","They must be busy at the moment."
"716424514AE4BA29707672B7CC54965D","This Skal's body expressed a strong toxin. Some new mutation? I had better take care.","This Skal's body expressed a strong toxin. Some new mutation? I had better take care."
"FEEBAD684E66E2527DC600945FA72F1F","This could be the box Lewis thought he lost. Huh! There's a letter inside.","This could be the box Lewis thought he lost. Huh! There's a letter inside."
"F332C3E94B2664E0354625AEA82A8B3C","This could be the public house Giselle Paxton mentioned. I should investigate further.","This could be the public house Giselle Paxton mentioned. I should investigate further."
"D3A3BF33409A5815F535F5BCCEAE8349","This creature doesn't seem aware of my presence.","This creature doesn't seem aware of my presence."
"F455163A4630C35958DFE39B9CB3288B","This creature was probably once Albert’s contact.","This creature was probably once Albert’s contact."
"E399D32D4D2497E5758A448BF1D7053B","This is Braille. I need someone who can read this.","This is Braille. I need someone who can read this."
"D420977F474729CE6F4A599C4E41CB90","This is an impressive knife. There is a name engraved on the metal. 'Clay'. What kind of man puts his name on a knife?","This is an impressive knife. There is a name engraved on the metal. 'Clay'. What kind of man puts his name on a knife?"
"34C3EC75410AB010B2C738A61CEA6656","This is a slaughterhouse!","This is a slaughterhouse!"
"2A81160D41005D1945C96EA2D45B2EAF","This is my watch! Damned grave robbers.","This is my watch! Damned grave robbers."
"7E36FCC9401E7B5150B3128E5E4DC46B","This is despicable.","This is despicable."
"4F6F867D4220B16C6A1D21BD143B6E52","This large bridge will allow me to reach the West End. I must cross it.","This large bridge will allow me to reach the West End. I must cross it."
"F358D5EB4E6A357E08DC04B700B7A514","This man stunned me with, his faith? His crucifix? This is not good news.","Цей чоловік приголомшив мене своєю вірою? Своїм розп'яття? Це погані новини."
"CE58A2C9415D9ED809AEB9983C222493","This man's far too old to be Samuel.","This man's far too old to be Samuel."
"F30C50A347BC00D75C43CF973186943F","This must be Clay Cox’s knife. A fine blade. No wonder he wants it back.","This must be Clay Cox’s knife. A fine blade. No wonder he wants it back."
"459A62104658929B274297B7268BEB22","This must be a picture of the bomb explosion Dyson Delaney spoke of.","This must be a picture of the bomb explosion Dyson Delaney spoke of."
"D9A4E56641465B1F411F54919F26F92D","This place looks like the picture I saw of the bomb site.","This place looks like the picture I saw of the bomb site."
"58751F0546EFF24DA4CB35869CEC6000","This place. Rain may have washed away the blood, but not the memory. My poor Mary…","This place. Rain may have washed away the blood, but not the memory. My poor Mary…"
"C1C19F4944427D4712572EA32F90F298","This poor creature can't be my maker. Could it be some sub-species of vampire? I must find a place to analyse the blood.","This poor creature can't be my maker. Could it be some sub-species of vampire? I must find a place to analyse the blood."
"363B0B184606E18EDB33FCBD330FA639","Those men are heading for the command post. I must follow them. With discretion.","Those men are heading for the command post. I must follow them. With discretion."
"4D74B3CE4149F45459B201B1313C375A","Tippets has made an egregious error. It's time we talked.","Tippets has made an egregious error. It's time we talked."
"46613C4A44C97E5FDDAC8DBB0BE1DB80","Tis perchance her inhabitants last dance alone to face death and pestilence.","Tis perchance her inhabitants last dance alone to face death and pestilence."
"33DC0D9C4BA826AE0406239F4FC1F347","Tis perhaps the countdown to oblivion for the once proud city of London.","Tis perhaps the countdown to oblivion for the once proud city of London."
"3925E7DD43FAE459677B599CA691E085","To enter that house, I must discover who this man really is. Maybe I could start by observing what he's up to. ","To enter that house, I must discover who this man really is. Maybe I could start by observing what he's up to. "
"EDAC14724C63921B39F8DA92BA8BCCFA","Tom has so much alcohol, he could keep this district afloat for quite some time.","Tom has so much alcohol, he could keep this district afloat for quite some time."
"9AAFDE5F4E3F6B47F92CA8B7BEE72065","Traces of pinkish foam at the corner of the lips. Some sort of drug overdose perhaps?","Traces of pinkish foam at the corner of the lips. Some sort of drug overdose perhaps?"
"763A16014FA16CBFB15981BEDD1CF497","Twelve dreams for the red queen under crown of stone.","Twelve dreams for the red queen under crown of stone."
"14B687F8491E9D5301F11D9711EE3ED0","Until alas she rises, woken by the hunger never fed.","Until alas she rises, woken by the hunger never fed."
"35FA638E426B88F70E94499D42051BE8","Until alas she rises, woken by the hunger never fed.","Until alas she rises, woken by the hunger never fed."
"66A87E0043FD4484A833A7B8C9B5254C","Until alas she rises, woken by the hunger never fed.","Until alas she rises, woken by the hunger never fed."
"A838EF3F4D454F3CA29AE3849F92CF0D","Until alas she rises, woken by the hunger never fed.","Until alas she rises, woken by the hunger never fed."
"7BAE24A14E2423765477239B8D717A10","We repelled the intruders for now, but how long before they return?","We repelled the intruders for now, but how long before they return?"
"282B64C2497EC6B814D34487DF0A70DA","Welcome, Doctor Reid. I did not imagine I would meet you here. I knew your father. He was a good man.","Вітаю, докторе Ріде. Не міг і уявити, що зустріну вас тут. Я знав вашого батька. Він був хорошою людиною."
"68339A6A4C487533754B0AA055194535","Welcome back, Dr. Reid.","Welcome back, Dr. Reid."
"0584D769482793222734A29C3D814D6E","Welcome to the Ascalon Club, Dr. Reid.","Welcome to the Ascalon Club, Dr. Reid."
"2050124647B6EE18F61AC593277C0CE0","Welcome to the Ascalon club then, Doctor Reid.","Welcome to the Ascalon club then, Doctor Reid."
"899CA4CD494845A813B4E593444FD8E0","Welcome to the Ascalon club then, Doctor Reid.","Welcome to the Ascalon club then, Doctor Reid."
"DA52A8EE42B76226D9005A8596D4B108","So, Mr. Hooks and Nurse Hawkins are an item? Those two have hidden their affections well.","So, Mr. Hooks and Nurse Hawkins are an item? Those two have hidden their affections well."
"976C200A4BDBB29A4BF921A3A656911B","What a mess! Something terrible happened here, but what?","What a mess! Something terrible happened here, but what?"
"AB02F9A349EDBE9B622952ABF5FD038C","What is darkness but lurking sun?","What is darkness but lurking sun?"
"B09FC3BC4AA96DF415944B94911E5C14","What is glass but tortured sand?","What is glass but tortured sand?"
"19DD8F554A7AEECDB7F2FAB171F20967","What is hate but jilted love?","What is hate but jilted love?"
"BD3C5E564885DC35602344AB4B02B4AE","What is life but death pending?","What is life but death pending?"
"C5CD884D4960519EB7B797AD3745FA69","What is song but a call to arms?","What is song but a call to arms?"
"4E2AA67340D1906831F52981E73CABBD","What is wall but enslaved stone?","What is wall but enslaved stone?"
"782A1B8A49D58578EC4989A917C61713","What on Earth?","What on Earth?"
"CC3C35ED444F49E5775DC9BECDC2F8A8","What sort of creature is this?","What sort of creature is this?"
"2C65E5BB4B3D53BB1A98178B0CFA2EB5","Whatever happened on this dock is between my sister and I. It does not concern God at all!","Whatever happened on this dock is between my sister and I. It does not concern God at all!"
"E7B1555B453F244FE7E1848ED7F4D509","When religion failed, men turned to science. I saw them build such vain cities. Crafting machines made for endless war.","When religion failed, men turned to science. I saw them build such vain cities. Crafting machines made for endless war."
"694147784FD095478134E99DDDCF20FE","When will we succumb, mortals and immortals alike? The next disaster is only a matter of time.","When will we succumb, mortals and immortals alike? The next disaster is only a matter of time."
"5EFCD4D240CC1737B57ED2BC616E42CD","While plotting factions close in around me, I am sworn to find the source of this epidemic.","While plotting factions close in around me, I am sworn to find the source of this epidemic."
"C4EBF1E74B969F2DC87657B6E1EBFC1F","Whitechapel This neighbourhood is linked somehow to the kind Lady Ashbury's blackmail. First, let's find this Petrescu fellow.","Whitechapel This neighbourhood is linked somehow to the kind Lady Ashbury's blackmail. First, let's find this Petrescu fellow."
"393622E04DE9E07A10ABACAA204BE575","Why is Mr. Delaney collecting old newspaper articles about bombings?","Why is Mr. Delaney collecting old newspaper articles about bombings?"
"5C0279B847CF34FB1D33F282822F938F","Yes, the place has changed since the explosion, but it was definitely here. I should find some way to pay my respects.","Yes, the place has changed since the explosion, but it was definitely here. I should find some way to pay my respects."
"209576C94096A13C7791628EB9E1CE60","You've found yourself a newer quest and so I leave you to it.","You've found yourself a newer quest and so I leave you to it."
"9165268847079C0037F530BAB043C427","You’ve chosen your path, my fallen champion, like others before you. Prey to lust and desire, slave to the everlasting thirst.","You’ve chosen your path, my fallen champion, like others before you. Prey to lust and desire, slave to the everlasting thirst."
"6EEDBFD0411B40D431C88E864746849E","You’ve lost your way, my champion bittersweet. I am moved to pity as I feel your rampant rage void of purpose or meaning.","You’ve lost your way, my champion bittersweet. I am moved to pity as I feel your rampant rage void of purpose or meaning."
"22EE073A44A15B91AA10A48E4251D6CC","« One prayer for the summoned called by this song<lf>Child born from darkness whose path he must find »","« One prayer for the summoned called by this song<lf>Child born from darkness whose path he must find »"
"9E27CB6C4210A1EB8F0A9595DF14C5AD","« One prayer for the summoned called by this song<lf>Child born from darkness whose path he must find »","« One prayer for the summoned called by this song<lf>Child born from darkness whose path he must find »"
"D912017540BD6F65545CD1B02B451FE4","« One prayer for the summoned called by this song<lf>Child born from darkness whose path he must find »","« One prayer for the summoned called by this song<lf>Child born from darkness whose path he must find »"
"DF476F65436E863FB0D9F5B48706C03F","« One prayer for the summoned called by this song<lf>Child born from darkness whose path he must find »<lf>","« One prayer for the summoned called by this song<lf>Child born from darkness whose path he must find »<lf>"
"[639BA31241CAF691D77E0B874A281953]::919EA3C049312EADD0A382BEE4E921E5","Done! Mr. Throgmorton should be happy.","Done! Mr. Throgmorton should be happy."
"[8D5A8E6349F1564B7E9548A36AAAA81E]::1BAFDA794433B171AFF413B72672F3CE","My dear sister… I don't know if I have the strength.","My dear sister… I don't know if I have the strength."
"[E12ABC7A4588CDCCE67F60B3EA69719A]::AD1F06C745C94D6C23F5418C52400921","He has locked the door behind him? I need to find another way to follow him.","He has locked the door behind him? I need to find another way to follow him."
